{
  "id": "theocracy-of-kepesh-bright-coast",
  "name": "Bright Coast",
  "region": "theocracy-of-kepesh",
  "source": "tanares",
  "description": "The coastline along the Storm Sea is rocky and rugged, with countless ships being claimed by its turbulent waters, sinking along their treasures. While drawing adventurers and treasure hunters, colonization here is scarce, limited to a few fishing villages. Legends about the spirits of the drowned and sea monsters give this region a cursed reputation. Kalistessenâmun’s forces know the coast is vulnerable, leaving an opening for the Kemets. Still, with a scarcity of warships and a coastline fraught with danger, the Kepesh often relies on hiring corsairs, Kolbjörn mercenaries, or adventurers for defense and patrol, an expensive necessity. The Kepesh rarely navigate the Storm Sea, as their vessels cannot match the heavily armored Kemet ships transporting undead hordes. The Kemets use their naval superiority to infiltrate the expansive coast, sending their undead and warbands to wreak havoc in the Theocracy territory with incursions that challenge the Pharaoh’s sovereignty and incite Kalistessenâmun’s wrath. Beneath certain coastal areas, extensive coral forests are guarded by merfolk. These bastions of marine life are the stages of conflict as the merfolks clash with the Samudara barbarians and defend against the Kemets, who seek to turn merfolk warriors into undead minions. The Samudara barbarians, adorned in fish leather and coral, are nocturnal raiders aboard their rudimentary boats, adding to the region’s woes. Known for their excellent swimming skills and the ability to hold their breath for long periods, they live as nomadic navigators plundering coastal villages, merfolk cities and any ship that crosses their path. They often attack Kepesh coastal villages and the Kemet ships. But what is behind them is what is truly scary. Deep within the Storm Sea’s caverns dwells a powerful Kraken and its offspring. The 186 Valentin Eloy (Order #42142262) Samudara appease this leviathan with offerings and serve its unknowable will. The Kraken’s animosity is particularly inflamed by the Kemets, driving it to purge both them and the Kepesh from the waters it claims."
}
