{
  "id": "central-empire-odraz-monastery-training",
  "name": "Odraz Monastery Training",
  "region": "central-empire",
  "source": "tanares",
  "description": "(Optional Rule) If you want to incorporate the distinctive style of Odraz class features. However, by choosing this alternate set of feaMonastery into your campaign, you have the option to entures, they will have to give up some of their original class able Paladin, Cleric, or Monk characters who have received core features in exchange for the features of the Odraz style. training at the monastery to choose from an alternate set of Odraz Monk Training Odraz Cleric Training Odraz Paladin Training Prerequisite: Monk Class Prerequisite: Cleric Class Prerequisite: Paladin Class Lose: Lose: Lose: At 1st level, Unarmored Defense. At 1st level you learn one less cantrip, and you At 1st level, Fighting Style At 2nd level, Step of the Wind (see Ki). can prepare one fewer spell after each long rest Gain: At 4th level, Slow Fall. (to a minimum of one spell). This does not Clerical Aptitude.On the 1st level, you gain change your spell slots, only the number of Gain: access to two cleric Cantrips of your choice. spells you can prepare. Armor Proficiency.At 1st level, you gain proYou can use your Charisma modifier for its Gain: ficiency with light and medium armor. spellcasting ability. Armored Monk. Starting at 1st level, Monk Martial Artist.At 1st level, you can roll a d4 Martial Artist.At 1st level, you can roll a d4 abilities and subclass abilities that are restricted in place of the normal damage of your unin place of the normal damage of your unwhile wearing light or medium armor no longer armed strike. armed strike. Martial Prowess.Starting at 1st level, you gain Divine Hands.Beginning on the 2nd level, after impose such restrictions. Paladin Weapon Training.At 1st level, you proficiency with all martial weapons. finishing a long rest, you can choose to forgo Holy Smite.Beginning at 2nd level, you gain the gain training with all martial weapons. All meall hit points in your Lay on Hands pool to lee weapons are also considered monk weappaladin’s Divine Smite feature, dealing 1d6 ragain one additional paladin spell slot of your ons for you. diant damage per spell slot level instead of 1d8. highest known level for that day. Radiant Flurry.At 4th level, when you use Swift Strikes.Starting at 5th level, when you Swift Strikes.Starting at 5th level, when you Flurry of Blows, you can spend an additional take the Attack action on your turn with an take the Attack action on your turn with an ki point to add 1d6 radiant damage to each of unarmed strike or a melee weapon, you can unarmed strike or a melee weapon, you can your Flurry of Blows attacks. make one unarmed strike as a bonus action. make one unarmed strike as a bonus action. Note: When losing a class feature or ability, you also lose access to any feature or ability from your subclass that requires the feature you lost. For example, if your subclass made your Step of the Wind also cause you to ignore difficult terrain, you would lose this feature as you no longer have access to Step of the Wind as an Odraz Monk. 96 Valentin Eloy (Order #42142262) 97"
}
